<?xml version="1.0" encoding="UTF-8"?>
<xs:schema xmlns:xs="http://www.w3.org/2001/XMLSchema">
  <xs:element name="artistas">
    <xs:complexType>
      <xs:sequence>
        <xs:element name="artista" maxOccurs="unbounded">
          <xs:complexType>
            <xs:sequence>
              <xs:element name="nombre" type="xs:string"/>
              <xs:element name="genero" type="xs:string"/>
              <xs:element name="imagen" type="xs:string"/>
              <xs:element name="album">
                <xs:complexType>
                  <xs:sequence>
                    <xs:element name="titulo" type="xs:string"/>
                    <xs:element name="año" type="xs:date"/>
                    <xs:element name="reproducciones" type="xs:string"/>
                  </xs:sequence>
                </xs:complexType>
              </xs:element>
            </xs:sequence>
            <xs:attribute name="id" type="xs:int" use="required"/>
          </xs:complexType>
        </xs:element>
      </xs:sequence>
    </xs:complexType>
  </xs:element>
</xs:schema>